<?xml version='1.0' encoding='UTF-8' standalone='no'?>
<doxyfile xmlns:xsi="http://www.w3.org/2001/XMLSchema-instance" xsi:noNamespaceSchemaLocation="doxyfile.xsd" version="1.18.0" xml:lang="en-US">
  <option  id='DOXYFILE_ENCODING' default='yes' type='string'><value><![CDATA[UTF-8]]></value></option>
  <option  id='PROJECT_NAME' default='yes' type='string'><value><![CDATA["My Project"]]></value></option>
  <option  id='PROJECT_NUMBER' default='yes' type='string'><value><![CDATA[]]></value></option>
  <option  id='PROJECT_BRIEF' default='yes' type='string'><value><![CDATA[]]></value></option>
  <option  id='PROJECT_LOGO' default='yes' type='string'><value><![CDATA[]]></value></option>
  <option  id='PROJECT_ICON' default='yes' type='string'><value><![CDATA[]]></value></option>
  <option  id='OUTPUT_DIRECTORY' default='no' type='string'><value><![CDATA[/home/runner/work/StarDS/StarDS/docs-site/site/assets/.doxy/StarCPPAPI]]></value></option>
  <option  id='CREATE_SUBDIRS' default='yes' type='bool'><value>NO</value></option>
  <option  id='CREATE_SUBDIRS_LEVEL' default='yes' type='int'><value>8</value></option>
  <option  id='ALLOW_UNICODE_NAMES' default='yes' type='bool'><value>NO</value></option>
  <option  id='OUTPUT_LANGUAGE' default='yes' type='string'><value>English</value></option>
  <option  id='BRIEF_MEMBER_DESC' default='yes' type='bool'><value>YES</value></option>
  <option  id='REPEAT_BRIEF' default='yes' type='bool'><value>YES</value></option>
  <option  id='ABBREVIATE_BRIEF' default='yes' type='stringlist'>
    <value><![CDATA["The $name class"]]></value>
    <value><![CDATA["The $name widget"]]></value>
    <value><![CDATA["The $name file"]]></value>
    <value><![CDATA[is]]></value>
    <value><![CDATA[provides]]></value>
    <value><![CDATA[specifies]]></value>
    <value><![CDATA[contains]]></value>
    <value><![CDATA[represents]]></value>
    <value><![CDATA[a]]></value>
    <value><![CDATA[an]]></value>
    <value><![CDATA[the]]></value>
  </option>
  <option  id='ALWAYS_DETAILED_SEC' default='yes' type='bool'><value>NO</value></option>
  <option  id='INLINE_INHERITED_MEMB' default='yes' type='bool'><value>NO</value></option>
  <option  id='FULL_PATH_NAMES' default='yes' type='bool'><value>YES</value></option>
  <option  id='STRIP_FROM_PATH' default='yes' type='stringlist'>
  </option>
  <option  id='STRIP_FROM_INC_PATH' default='yes' type='stringlist'>
  </option>
  <option  id='SHORT_NAMES' default='yes' type='bool'><value>NO</value></option>
  <option  id='JAVADOC_AUTOBRIEF' default='yes' type='bool'><value>NO</value></option>
  <option  id='JAVADOC_BANNER' default='yes' type='bool'><value>NO</value></option>
  <option  id='QT_AUTOBRIEF' default='yes' type='bool'><value>NO</value></option>
  <option  id='MULTILINE_CPP_IS_BRIEF' default='yes' type='bool'><value>NO</value></option>
  <option  id='PYTHON_DOCSTRING' default='yes' type='bool'><value>YES</value></option>
  <option  id='INHERIT_DOCS' default='yes' type='bool'><value>YES</value></option>
  <option  id='SEPARATE_MEMBER_PAGES' default='yes' type='bool'><value>NO</value></option>
  <option  id='TAB_SIZE' default='yes' type='int'><value>4</value></option>
  <option  id='ALIASES' default='yes' type='stringlist'>
  </option>
  <option  id='OPTIMIZE_OUTPUT_FOR_C' default='yes' type='bool'><value>NO</value></option>
  <option  id='OPTIMIZE_OUTPUT_JAVA' default='yes' type='bool'><value>NO</value></option>
  <option  id='OPTIMIZE_FOR_FORTRAN' default='yes' type='bool'><value>NO</value></option>
  <option  id='OPTIMIZE_OUTPUT_VHDL' default='yes' type='bool'><value>NO</value></option>
  <option  id='OPTIMIZE_OUTPUT_SLICE' default='yes' type='bool'><value>NO</value></option>
  <option  id='EXTENSION_MAPPING' default='yes' type='stringlist'>
  </option>
  <option  id='MARKDOWN_SUPPORT' default='yes' type='bool'><value>YES</value></option>
  <option  id='MARKDOWN_STRICT' default='yes' type='bool'><value>YES</value></option>
  <option  id='TOC_INCLUDE_HEADINGS' default='yes' type='int'><value>6</value></option>
  <option  id='MARKDOWN_ID_STYLE' default='yes' type='string'><value>DOXYGEN</value></option>
  <option  id='AUTOLINK_SUPPORT' default='yes' type='bool'><value>YES</value></option>
  <option  id='AUTOLINK_IGNORE_WORDS' default='yes' type='stringlist'>
  </option>
  <option  id='BUILTIN_STL_SUPPORT' default='yes' type='bool'><value>NO</value></option>
  <option  id='CPP_CLI_SUPPORT' default='yes' type='bool'><value>NO</value></option>
  <option  id='SIP_SUPPORT' default='yes' type='bool'><value>NO</value></option>
  <option  id='IDL_PROPERTY_SUPPORT' default='yes' type='bool'><value>YES</value></option>
  <option  id='DISTRIBUTE_GROUP_DOC' default='yes' type='bool'><value>NO</value></option>
  <option  id='GROUP_NESTED_COMPOUNDS' default='yes' type='bool'><value>NO</value></option>
  <option  id='SUBGROUPING' default='yes' type='bool'><value>YES</value></option>
  <option  id='INLINE_GROUPED_CLASSES' default='yes' type='bool'><value>NO</value></option>
  <option  id='INLINE_SIMPLE_STRUCTS' default='yes' type='bool'><value>NO</value></option>
  <option  id='TYPEDEF_HIDES_STRUCT' default='yes' type='bool'><value>NO</value></option>
  <option  id='LOOKUP_CACHE_SIZE' default='yes' type='int'><value>0</value></option>
  <option  id='NUM_PROC_THREADS' default='yes' type='int'><value>1</value></option>
  <option  id='TIMESTAMP' default='yes' type='string'><value>NO</value></option>
  <option  id='EXTRACT_ALL' default='yes' type='bool'><value>NO</value></option>
  <option  id='EXTRACT_PRIVATE' default='yes' type='bool'><value>NO</value></option>
  <option  id='EXTRACT_PRIV_VIRTUAL' default='yes' type='bool'><value>NO</value></option>
  <option  id='EXTRACT_PACKAGE' default='yes' type='bool'><value>NO</value></option>
  <option  id='EXTRACT_STATIC' default='yes' type='bool'><value>NO</value></option>
  <option  id='EXTRACT_LOCAL_CLASSES' default='yes' type='bool'><value>YES</value></option>
  <option  id='EXTRACT_LOCAL_METHODS' default='yes' type='bool'><value>NO</value></option>
  <option  id='EXTRACT_ANON_NSPACES' default='yes' type='bool'><value>NO</value></option>
  <option  id='RESOLVE_UNNAMED_PARAMS' default='yes' type='bool'><value>YES</value></option>
  <option  id='HIDE_UNDOC_MEMBERS' default='no' type='bool'><value>YES</value></option>
  <option  id='HIDE_UNDOC_CLASSES' default='yes' type='bool'><value>NO</value></option>
  <option  id='HIDE_UNDOC_NAMESPACES' default='yes' type='bool'><value>YES</value></option>
  <option  id='HIDE_FRIEND_COMPOUNDS' default='yes' type='bool'><value>NO</value></option>
  <option  id='HIDE_IN_BODY_DOCS' default='yes' type='bool'><value>NO</value></option>
  <option  id='INTERNAL_DOCS' default='yes' type='bool'><value>NO</value></option>
  <option  id='CASE_SENSE_NAMES' default='yes' type='string'><value>SYSTEM</value></option>
  <option  id='HIDE_SCOPE_NAMES' default='yes' type='bool'><value>NO</value></option>
  <option  id='HIDE_COMPOUND_REFERENCE' default='yes' type='bool'><value>NO</value></option>
  <option  id='SHOW_HEADERFILE' default='yes' type='bool'><value>YES</value></option>
  <option  id='SHOW_INCLUDE_FILES' default='yes' type='bool'><value>YES</value></option>
  <option  id='SHOW_GROUPED_MEMB_INC' default='yes' type='bool'><value>NO</value></option>
  <option  id='FORCE_LOCAL_INCLUDES' default='yes' type='bool'><value>NO</value></option>
  <option  id='INLINE_INFO' default='yes' type='bool'><value>YES</value></option>
  <option  id='SORT_MEMBER_DOCS' default='yes' type='bool'><value>YES</value></option>
  <option  id='SORT_BRIEF_DOCS' default='yes' type='bool'><value>NO</value></option>
  <option  id='SORT_MEMBERS_CTORS_1ST' default='yes' type='bool'><value>NO</value></option>
  <option  id='SORT_GROUP_NAMES' default='yes' type='bool'><value>NO</value></option>
  <option  id='SORT_BY_SCOPE_NAME' default='yes' type='bool'><value>NO</value></option>
  <option  id='STRICT_PROTO_MATCHING' default='yes' type='bool'><value>NO</value></option>
  <option  id='GENERATE_TODOLIST' default='yes' type='bool'><value>YES</value></option>
  <option  id='GENERATE_TESTLIST' default='yes' type='bool'><value>YES</value></option>
  <option  id='GENERATE_BUGLIST' default='yes' type='bool'><value>YES</value></option>
  <option  id='GENERATE_DEPRECATEDLIST' default='yes' type='bool'><value>YES</value></option>
  <option  id='GENERATE_REQUIREMENTS' default='yes' type='bool'><value>YES</value></option>
  <option  id='REQ_TRACEABILITY_INFO' default='yes' type='string'><value>YES</value></option>
  <option  id='ENABLED_SECTIONS' default='yes' type='stringlist'>
  </option>
  <option  id='MAX_INITIALIZER_LINES' default='yes' type='int'><value>30</value></option>
  <option  id='SHOW_USED_FILES' default='yes' type='bool'><value>YES</value></option>
  <option  id='SHOW_FILES' default='yes' type='bool'><value>YES</value></option>
  <option  id='SHOW_NAMESPACES' default='yes' type='bool'><value>YES</value></option>
  <option  id='FILE_VERSION_FILTER' default='yes' type='string'><value><![CDATA[]]></value></option>
  <option  id='LAYOUT_FILE' default='yes' type='string'><value><![CDATA[]]></value></option>
  <option  id='CITE_BIB_FILES' default='yes' type='stringlist'>
  </option>
  <option  id='EXTERNAL_TOOL_PATH' default='yes' type='stringlist'>
  </option>
  <option  id='QUIET' default='yes' type='bool'><value>NO</value></option>
  <option  id='WARNINGS' default='yes' type='bool'><value>YES</value></option>
  <option  id='WARN_IF_UNDOCUMENTED' default='yes' type='bool'><value>YES</value></option>
  <option  id='WARN_IF_DOC_ERROR' default='yes' type='bool'><value>YES</value></option>
  <option  id='WARN_IF_INCOMPLETE_DOC' default='yes' type='bool'><value>YES</value></option>
  <option  id='WARN_NO_PARAMDOC' default='yes' type='bool'><value>NO</value></option>
  <option  id='WARN_IF_UNDOC_ENUM_VAL' default='yes' type='bool'><value>NO</value></option>